{
  "schema_version": "0.4",
  "ir_kind": "core",
  "metadata": {
    "title": "Centrifugation and red blood cell lysis",
    "source": {
      "type": "paper_pdf",
      "id": "s41596-020-00474-1.pdf"
    }
  },
  "resources": {
    "materials": [
      {
        "id": "d_bsa",
        "type": "material",
        "name": "D-BSA"
      },
      {
        "id": "rbc_lysis_buffer",
        "type": "material",
        "name": "red blood cell lysis buffer"
      }
    ],
    "containers": [
      {
        "id": "falcon_15ml",
        "type": "tube",
        "description": "15‑ml Falcon tube"
      }
    ],
    "equipment": [
      {
        "id": "centrifuge",
        "type": "centrifuge"
      },
      {
        "id": "vacuum_system",
        "type": "vacuum_aspirator"
      },
      {
        "id": "serological_pipette",
        "type": "pipette"
      },
      {
        "id": "p1000_pipette",
        "type": "pipette"
      }
    ],
    "samples": [
      {
        "id": "flow_through_22_26",
        "type": "sample",
        "description": "flow‑through from Steps 22–26"
      },
      {
        "id": "tissue_pellet",
        "type": "sample",
        "description": "tissue pellet after centrifugation"
      }
    ],
    "data": []
  },
  "protocol": {
    "steps": [
      {
        "id": "s1",
        "op": "allocate",
        "params": {
          "allocate_kind": "sample"
        },
        "outputs": [
          {
            "kind": "sample",
            "id": "flow_through_22_26"
          }
        ],
        "inputs": []
      },
      {
        "id": "s2",
        "op": "run_device",
        "params": {
          "device_kind": "centrifuge",
          "program": {
            "program_name": "450g_5min_8C"
          }
        },
        "inputs": [],
        "outputs": []
      },
      {
        "id": "s3",
        "op": "transfer",
        "params": {
          "source": "flow_through_22_26",
          "destination": "falcon_15ml",
          "amount": {
            "value": 4,
            "unit": "ml"
          }
        },
        "inputs": [],
        "outputs": []
      },
      {
        "id": "s4",
        "op": "manipulate",
        "params": {
          "action_kind": "resuspend"
        },
        "inputs": [],
        "outputs": []
      },
      {
        "id": "s5",
        "op": "transfer",
        "params": {
          "source": "d_bsa",
          "destination": "falcon_15ml",
          "amount": {
            "value": 10.0,
            "unit": "ml"
          }
        },
        "inputs": [],
        "outputs": []
      },
      {
        "id": "s6",
        "op": "manipulate",
        "params": {
          "action_kind": "mix"
        },
        "inputs": [],
        "outputs": []
      },
      {
        "id": "s7",
        "op": "run_device",
        "params": {
          "device_kind": "centrifuge",
          "program": {
            "program_name": "450g_5min_8C"
          }
        },
        "inputs": [],
        "outputs": []
      },
      {
        "id": "s8",
        "op": "annotate",
        "params": {
          "note": "Transfer from falcon_15ml to waste until 1 ml remains"
        },
        "inputs": [],
        "outputs": []
      },
      {
        "id": "s9",
        "op": "annotate",
        "params": {
          "note": "Let tube rest 1 min to allow D‑BSA to settle, then remove residual D‑BSA with P1000 pipette"
        },
        "inputs": [],
        "outputs": []
      },
      {
        "id": "s10",
        "op": "annotate",
        "params": {
          "note": "Optional: add 1–2 ml red blood cell lysis buffer, resuspend pellet, incubate 2 min at RT"
        },
        "inputs": [],
        "outputs": []
      },
      {
        "id": "s11",
        "op": "transfer",
        "params": {
          "source": "d_bsa",
          "destination": "falcon_15ml",
          "amount": {
            "value": 10.0,
            "unit": "ml"
          }
        },
        "inputs": [],
        "outputs": []
      },
      {
        "id": "s12",
        "op": "manipulate",
        "params": {
          "action_kind": "mix"
        },
        "inputs": [],
        "outputs": []
      },
      {
        "id": "s13",
        "op": "run_device",
        "params": {
          "device_kind": "centrifuge",
          "program": {
            "program_name": "450g_5min_8C"
          }
        },
        "inputs": [],
        "outputs": []
      },
      {
        "id": "s14",
        "op": "annotate",
        "params": {
          "note": "Transfer from falcon_15ml to waste as described in Step 30"
        },
        "inputs": [],
        "outputs": []
      }
    ],
    "start_step_id": "s1",
    "edges": [
      {
        "from": "s1",
        "to": "s2"
      },
      {
        "from": "s2",
        "to": "s3"
      },
      {
        "from": "s3",
        "to": "s4"
      },
      {
        "from": "s4",
        "to": "s5"
      },
      {
        "from": "s5",
        "to": "s6"
      },
      {
        "from": "s6",
        "to": "s7"
      },
      {
        "from": "s7",
        "to": "s8"
      },
      {
        "from": "s8",
        "to": "s9"
      },
      {
        "from": "s9",
        "to": "s10"
      },
      {
        "from": "s10",
        "to": "s11"
      },
      {
        "from": "s11",
        "to": "s12"
      },
      {
        "from": "s12",
        "to": "s13"
      },
      {
        "from": "s13",
        "to": "s14"
      }
    ],
    "detail_level": 0
  }
}