{
  "schema_version": "0.4",
  "ir_kind": "core",
  "metadata": {
    "title": "Dilute TrypLE",
    "source": {
      "type": "paper_pdf",
      "id": "s41596-020-00441-w.pdf"
    }
  },
  "resources": {
    "materials": [
      {
        "id": "m1",
        "name": "DMEM/F12"
      }
    ],
    "containers": [
      {
        "id": "c1",
        "type": "well_plate",
        "description": "Plate with wells containing TrypLE"
      }
    ],
    "equipment": [],
    "samples": [],
    "data": []
  },
  "protocol": {
    "steps": [
      {
        "id": "s1",
        "op": "allocate",
        "params": {
          "material": "m1",
          "quantity": {
            "value": 500,
            "unit": "μl"
          }
        },
        "inputs": [],
        "outputs": []
      },
      {
        "id": "s2",
        "op": "transfer",
        "params": {
          "source": "s1",
          "destination": "c1",
          "amount": {
            "value": 500,
            "unit": "μl"
          }
        },
        "inputs": [],
        "outputs": []
      },
      {
        "id": "s3",
        "op": "annotate",
        "params": {
          "note": "Added 500 μl of warm DMEM/F12 to each well to sufficiently dilute the TrypLE."
        },
        "inputs": [],
        "outputs": []
      }
    ],
    "start_step_id": "s1",
    "edges": [
      {
        "from": "s1",
        "to": "s2"
      },
      {
        "from": "s2",
        "to": "s3"
      }
    ],
    "detail_level": 0
  }
}