{
  "schema_version": "0.4",
  "ir_kind": "core",
  "metadata": {
    "title": "Protocol",
    "source": {
      "type": "paper_pdf",
      "id": "s41596-020-0379-4.pdf"
    }
  },
  "resources": {
    "materials": [],
    "containers": [],
    "equipment": [],
    "samples": [],
    "data": []
  },
  "protocol": {
    "steps": [
      {
        "id": "s1",
        "op": "annotate",
        "params": {
          "note": "Tissue collection: obtain viable (pink) tumor tissue; store in ice-cold basic medium with 10 µM Y-27632 or ice-cold PBS during transport to minimize cell death."
        },
        "inputs": [],
        "outputs": []
      },
      {
        "id": "s2",
        "op": "annotate",
        "params": {
          "note": "Tissue pieces collected and stored in media as soon as possible, ideally in operating room or pathological laboratory."
        },
        "inputs": [],
        "outputs": []
      },
      {
        "id": "s3",
        "op": "annotate",
        "params": {
          "note": "Organoids can be generated from tissue stored up to 72 h at 4 °C or from cryopreserved tissue, though efficiency is lower."
        },
        "inputs": [],
        "outputs": []
      },
      {
        "id": "s4",
        "op": "manipulate",
        "params": {
          "action_kind": "dislodge_cells"
        },
        "inputs": [],
        "outputs": []
      },
      {
        "id": "s5",
        "op": "annotate",
        "params": {
          "note": "Mechanical fragmentation of tissue using scalpel or razor blades."
        },
        "inputs": [],
        "outputs": []
      },
      {
        "id": "s6",
        "op": "run_device",
        "params": {
          "device_kind": "incubator",
          "program": "digest tissue fragments at 37 °C using enzymes (collagenase, Liberase, trypsin, TrypLE, hyaluronidase, dispase, DNase, EDTA); digestion time: 30 min to overnight; shake regularly to avoid clumping; add DNase if needed."
        },
        "inputs": [],
        "outputs": []
      },
      {
        "id": "s7",
        "op": "transfer",
        "params": {
          "source": "digested_cell_suspension",
          "target": "ECM_droplet",
          "amount": "unknown"
        },
        "inputs": [],
        "outputs": []
      },
      {
        "id": "s8",
        "op": "annotate",
        "params": {
          "note": "Plating cell preparations into drops of ECM hydrogel (BME or Matrigel; 2–10% or 50–100% in some cases); alternatives include piglet mesenchyme–derived ECM or defined matrices."
        },
        "inputs": [],
        "outputs": []
      },
      {
        "id": "s9",
        "op": "run_device",
        "params": {
          "device_kind": "incubator",
          "program": "culture organoids at 37 °C and 5% CO2 in advanced DMEM/F12-based growth medium; refresh medium every 2–3 days; include 10 µM Y-27632 for first two passages."
        },
        "inputs": [],
        "outputs": []
      },
      {
        "id": "s10",
        "op": "annotate",
        "params": {
          "note": "Monitor cultures for bacterial/fungal infections; if infected, add 5 M NaOH, incubate 1 h, remove contents, wash with 70% ethanol, replace lid."
        },
        "inputs": [],
        "outputs": []
      },
      {
        "id": "s11",
        "op": "annotate",
        "params": {
          "note": "Use penicillin/streptomycin in basic medium; for colon/oral mucosa samples, add Primocin, vancomycin, gentamicin, and/or caspofungin for first two passages."
        },
        "inputs": [],
        "outputs": []
      },
      {
        "id": "s12",
        "op": "run_device",
        "params": {
          "device_kind": "incubator",
          "program": "maintain organoid cultures under standard conditions; passage every 14 days with 1:2 split ratio."
        },
        "inputs": [],
        "outputs": []
      },
      {
        "id": "s13",
        "op": "manipulate",
        "params": {
          "action_kind": "dislodge_cells"
        },
        "inputs": [],
        "outputs": []
      },
      {
        "id": "s14",
        "op": "annotate",
        "params": {
          "note": "For compact organoids: use TrypLE for passaging; monitor under microscope every 5 min; stop when mixture of 3–5 cell clusters and single cells observed; use P1000 pipette to aid disruption."
        },
        "inputs": [],
        "outputs": []
      },
      {
        "id": "s15",
        "op": "annotate",
        "params": {
          "note": "For cystic/grape-like organoids: use mechanical shearing instead of TrypLE."
        },
        "inputs": [],
        "outputs": []
      },
      {
        "id": "s16",
        "op": "annotate",
        "params": {
          "note": "Add 10 µM Y-27632 to medium immediately after passaging; discontinue after 2–3 days when medium is refreshed."
        },
        "inputs": [],
        "outputs": []
      },
      {
        "id": "s17",
        "op": "annotate",
        "params": {
          "note": "Freeze organoids 2–3 days after passaging when highly proliferative; avoid freezing single cells or large differentiated organoids."
        },
        "inputs": [],
        "outputs": []
      },
      {
        "id": "s18",
        "op": "annotate",
        "params": {
          "note": "Recovery rate after thawing >50%; recommend at least one passage after thawing before drug screening."
        },
        "inputs": [],
        "outputs": []
      },
      {
        "id": "s19",
        "op": "annotate",
        "params": {
          "note": "Thawed organoids may show altered morphology; additional passages may be needed for poor recovery."
        },
        "inputs": [],
        "outputs": []
      },
      {
        "id": "s20",
        "op": "annotate",
        "params": {
          "note": "QC: assess tumor purity of organoid culture using variant allele frequency from bulk DNA sequencing."
        },
        "inputs": [],
        "outputs": []
      },
      {
        "id": "s21",
        "op": "annotate",
        "params": {
          "note": "Tumor cell enrichment methods: Nutlin-3 for TP53 mutant selection; EGF withdrawal for RAS mutant selection; removal of Wnt/RSPO for specific mutation/subtype selection."
        },
        "inputs": [],
        "outputs": []
      },
      {
        "id": "s22",
        "op": "annotate",
        "params": {
          "note": "Use minimal medium selection with caution due to potential loss of heterogeneity and unknown genetic background."
        },
        "inputs": [],
        "outputs": []
      },
      {
        "id": "s23",
        "op": "annotate",
        "params": {
          "note": "Organoids are collected, filtered, counted, and plated at desired density for drug screening."
        },
        "inputs": [],
        "outputs": []
      },
      {
        "id": "s24",
        "op": "annotate",
        "params": {
          "note": "Therapy exposure: organoids exposed to drug 1 day after plating if plated as single cells; some protocols allow recovery period before treatment (1–24 days total exposure)."
        },
        "inputs": [],
        "outputs": []
      },
      {
        "id": "s25",
        "op": "observe",
        "params": {
          "modality": "instrument_readout",
          "features": [
            "cell viability"
          ]
        },
        "inputs": [],
        "outputs": []
      },
      {
        "id": "s26",
        "op": "annotate",
        "params": {
          "note": "Readout typically performed 5–6 days after treatment start, but ranges from 1–24 days."
        },
        "inputs": [],
        "outputs": []
      },
      {
        "id": "s27",
        "op": "annotate",
        "params": {
          "note": "Response to therapy is comparable whether organoids are exposed as single cells or multicellular structures."
        },
        "inputs": [],
        "outputs": []
      }
    ],
    "start_step_id": "s1",
    "edges": [
      {
        "from": "s1",
        "to": "s2"
      },
      {
        "from": "s2",
        "to": "s3"
      },
      {
        "from": "s3",
        "to": "s4"
      },
      {
        "from": "s4",
        "to": "s5"
      },
      {
        "from": "s5",
        "to": "s6"
      },
      {
        "from": "s6",
        "to": "s7"
      },
      {
        "from": "s7",
        "to": "s8"
      },
      {
        "from": "s8",
        "to": "s9"
      },
      {
        "from": "s9",
        "to": "s10"
      },
      {
        "from": "s10",
        "to": "s11"
      },
      {
        "from": "s11",
        "to": "s12"
      },
      {
        "from": "s12",
        "to": "s13"
      },
      {
        "from": "s13",
        "to": "s14"
      },
      {
        "from": "s14",
        "to": "s15"
      },
      {
        "from": "s15",
        "to": "s16"
      },
      {
        "from": "s16",
        "to": "s17"
      },
      {
        "from": "s17",
        "to": "s18"
      },
      {
        "from": "s18",
        "to": "s19"
      },
      {
        "from": "s19",
        "to": "s20"
      },
      {
        "from": "s20",
        "to": "s21"
      },
      {
        "from": "s21",
        "to": "s22"
      },
      {
        "from": "s22",
        "to": "s23"
      },
      {
        "from": "s23",
        "to": "s24"
      },
      {
        "from": "s24",
        "to": "s25"
      },
      {
        "from": "s25",
        "to": "s26"
      },
      {
        "from": "s26",
        "to": "s27"
      }
    ],
    "detail_level": 0
  }
}