{
  "schema_version": "0.4",
  "ir_kind": "core",
  "metadata": {
    "title": "Crypt isolation and organoid embedding",
    "source": {
      "type": "paper_pdf",
      "id": "s41467-024-55567-2.pdf"
    }
  },
  "resources": {
    "materials": [
      {
        "id": "m1",
        "name": "DPBS",
        "type": "buffer"
      },
      {
        "id": "m2",
        "name": "EDTA",
        "concentration": "2.5 mM",
        "type": "chemical"
      },
      {
        "id": "m3",
        "name": "Cultrex RGF BME",
        "vendor": "R&D Systems",
        "type": "extracellular_matrix"
      },
      {
        "id": "m4",
        "name": "Y-27632",
        "concentration": "10 Î¼M",
        "vendor": "TargetMol",
        "type": "chemical"
      }
    ],
    "containers": [
      {
        "id": "c1",
        "type": "well_plate",
        "well_count": 48
      }
    ],
    "equipment": [],
    "samples": [
      {
        "id": "sample1",
        "name": "sample1"
      }
    ],
    "data": []
  },
  "protocol": {
    "steps": [
      {
        "id": "s1",
        "op": "manipulate",
        "params": {
          "action_kind": "rinse"
        },
        "inputs": [
          {
            "kind": "sample",
            "id": "sample1"
          }
        ],
        "outputs": [
          {
            "kind": "sample",
            "id": "sample1"
          }
        ]
      },
      {
        "id": "s2",
        "op": "transfer",
        "params": {
          "source": "sample1",
          "destination": "c1",
          "amount": {
            "value": "unknown",
            "unit": "unknown"
          }
        },
        "inputs": [
          {
            "kind": "sample",
            "id": "sample1"
          }
        ],
        "outputs": [
          {
            "kind": "sample",
            "id": "sample1"
          }
        ]
      },
      {
        "id": "s3",
        "op": "run_device",
        "params": {
          "device_kind": "incubator",
          "program": {
            "program_name": "EDTA_treatment_4C_40min"
          }
        },
        "inputs": [
          {
            "kind": "container",
            "id": "c1"
          }
        ],
        "outputs": [
          {
            "kind": "container",
            "id": "c1"
          }
        ]
      },
      {
        "id": "s4",
        "op": "transfer",
        "params": {
          "source": "c1",
          "destination": "c1",
          "amount": {
            "value": "unknown",
            "unit": "unknown"
          }
        },
        "inputs": [
          {
            "kind": "container",
            "id": "c1"
          }
        ],
        "outputs": [
          {
            "kind": "container",
            "id": "c1"
          }
        ]
      },
      {
        "id": "s5",
        "op": "manipulate",
        "params": {
          "action_kind": "spread_on_plate"
        },
        "inputs": [
          {
            "kind": "container",
            "id": "c1"
          }
        ],
        "outputs": [
          {
            "kind": "container",
            "id": "c1"
          }
        ]
      },
      {
        "id": "s6",
        "op": "transfer",
        "params": {
          "source": "m3",
          "destination": "c1",
          "amount": {
            "value": "unknown",
            "unit": "unknown"
          }
        },
        "inputs": [
          {
            "kind": "material",
            "id": "m3"
          }
        ],
        "outputs": [
          {
            "kind": "container",
            "id": "c1"
          }
        ]
      },
      {
        "id": "s7",
        "op": "transfer",
        "params": {
          "source": "c1",
          "destination": "c1",
          "amount": {
            "value": "unknown",
            "unit": "unknown"
          }
        },
        "inputs": [
          {
            "kind": "container",
            "id": "c1"
          }
        ],
        "outputs": [
          {
            "kind": "container",
            "id": "c1"
          }
        ]
      },
      {
        "id": "s8",
        "op": "transfer",
        "params": {
          "source": "m4",
          "destination": "c1",
          "amount": {
            "value": "unknown",
            "unit": "unknown"
          }
        },
        "inputs": [
          {
            "kind": "material",
            "id": "m4"
          }
        ],
        "outputs": [
          {
            "kind": "container",
            "id": "c1"
          }
        ]
      }
    ],
    "start_step_id": "s1",
    "edges": [
      {
        "from": "s1",
        "to": "s2"
      },
      {
        "from": "s2",
        "to": "s3"
      },
      {
        "from": "s3",
        "to": "s4"
      },
      {
        "from": "s4",
        "to": "s5"
      },
      {
        "from": "s5",
        "to": "s6"
      },
      {
        "from": "s6",
        "to": "s7"
      },
      {
        "from": "s7",
        "to": "s8"
      }
    ],
    "detail_level": 0
  }
}