{
  "schema_version": "0.4",
  "ir_kind": "core",
  "metadata": {
    "title": "Prepare stock cell suspension for HFOs",
    "source": {
      "type": "paper_pdf",
      "id": "s41596-021-00629-8.pdf"
    }
  },
  "resources": {
    "materials": [
      {
        "id": "m1",
        "name": "E8 + 10 μM Y27632",
        "type": "media"
      }
    ],
    "containers": [
      {
        "id": "c1",
        "type": "tube",
        "name": "suspension tube"
      }
    ],
    "equipment": [],
    "samples": [
      {
        "id": "samp1",
        "type": "cell_sample",
        "name": "cells from Step 10"
      }
    ],
    "data": []
  },
  "protocol": {
    "steps": [
      {
        "id": "s1",
        "op": "allocate",
        "params": {
          "allocate_kind": "container"
        },
        "outputs": [
          {
            "kind": "container",
            "id": "c1"
          }
        ],
        "inputs": []
      },
      {
        "id": "s2",
        "op": "allocate",
        "params": {
          "allocate_kind": "material"
        },
        "outputs": [
          {
            "kind": "material",
            "id": "m1"
          }
        ],
        "inputs": []
      },
      {
        "id": "s3",
        "op": "allocate",
        "params": {
          "allocate_kind": "sample"
        },
        "outputs": [
          {
            "kind": "sample",
            "id": "samp1"
          }
        ],
        "inputs": []
      },
      {
        "id": "s4",
        "op": "transfer",
        "params": {
          "source": "m1",
          "destination": "c1",
          "amount": {
            "description": "appropriate volume of E8 + 10 μM Y27632"
          }
        },
        "inputs": [],
        "outputs": []
      },
      {
        "id": "s5",
        "op": "transfer",
        "params": {
          "source": "samp1",
          "destination": "c1",
          "amount": {
            "description": "appropriate amount of cells"
          }
        },
        "inputs": [],
        "outputs": []
      },
      {
        "id": "s6",
        "op": "manipulate",
        "params": {
          "action_kind": "resuspend",
          "target": "c1"
        },
        "inputs": [],
        "outputs": []
      }
    ],
    "start_step_id": "s1",
    "edges": [
      {
        "from": "s1",
        "to": "s2"
      },
      {
        "from": "s2",
        "to": "s3"
      },
      {
        "from": "s3",
        "to": "s4"
      },
      {
        "from": "s4",
        "to": "s5"
      },
      {
        "from": "s5",
        "to": "s6"
      }
    ],
    "detail_level": 0
  }
}