{
  "schema_version": "0.4",
  "ir_kind": "core",
  "metadata": {
    "title": "iNPC cryopreservation",
    "source": {
      "type": "paper_pdf",
      "id": "s41596-025-01236-7.pdf"
    }
  },
  "resources": {
    "materials": [
      {
        "id": "m1",
        "name": "Bambanker cell freezing medium"
      }
    ],
    "containers": [
      {
        "id": "c1",
        "type": "cryogenic_vial",
        "name": "1.5-ml Nalgene SYSTEM 100 cryogenic vial"
      }
    ],
    "equipment": [
      {
        "id": "e1",
        "type": "centrifuge"
      }
    ],
    "samples": [
      {
        "id": "d1",
        "name": "d1"
      },
      {
        "id": "s1",
        "name": "s1"
      },
      {
        "id": "s2_output",
        "name": "s2_output"
      },
      {
        "id": "s3_output",
        "name": "s3_output"
      },
      {
        "id": "s5_output",
        "name": "s5_output"
      }
    ],
    "data": []
  },
  "protocol": {
    "steps": [
      {
        "id": "s1",
        "op": "observe",
        "params": {
          "modality": "instrument_readout",
          "features": [
            "cell_count"
          ]
        },
        "inputs": [],
        "outputs": [
          {
            "kind": "sample",
            "id": "d1"
          }
        ]
      },
      {
        "id": "s2",
        "op": "manipulate",
        "params": {
          "action_kind": "resuspend"
        },
        "inputs": [
          {
            "kind": "sample",
            "id": "s1"
          }
        ],
        "outputs": [
          {
            "kind": "sample",
            "id": "s2_output"
          }
        ]
      },
      {
        "id": "s3",
        "op": "allocate",
        "params": {
          "allocate_kind": "sample",
          "volume": "0.5 ml",
          "number": 1
        },
        "inputs": [],
        "outputs": [
          {
            "kind": "sample",
            "id": "s3_output"
          }
        ]
      },
      {
        "id": "s4",
        "op": "transfer",
        "params": {
          "source": "s2_output",
          "destination": "s3_output",
          "amount": {
            "value": 0.5,
            "unit": "ml"
          }
        },
        "inputs": [
          {
            "kind": "sample",
            "id": "s2_output"
          }
        ],
        "outputs": []
      },
      {
        "id": "s5",
        "op": "run_device",
        "params": {
          "device_kind": "centrifuge",
          "program": {
            "program_name": "unknown"
          }
        },
        "inputs": [
          {
            "kind": "sample",
            "id": "s2_output"
          }
        ],
        "outputs": [
          {
            "kind": "sample",
            "id": "s5_output"
          }
        ]
      }
    ],
    "start_step_id": "s1",
    "edges": [
      {
        "from": "s1",
        "to": "s2"
      },
      {
        "from": "s2",
        "to": "s5"
      },
      {
        "from": "s5",
        "to": "s3"
      },
      {
        "from": "s3",
        "to": "s4"
      }
    ],
    "detail_level": 0
  }
}