{
  "ir_kind": "core",
  "metadata": {
    "source": {
      "id": "s41592-021-01344-8",
      "type": "paper"
    },
    "title": "Design and use iTracer‑perturb vectors"
  },
  "protocol": {
    "detail_level": 0,
    "edges": [
      {
        "from": "s1",
        "to": "s1"
      }
    ],
    "start_step_id": "s1",
    "steps": [
      {
        "annotations": {
          "description": "We designed an experiment in which iTracer‑perturb vectors contain a gRNA targeting the gene of interest (bU6) and GFP (hU6) as well as RFP and barcoded GFP reporters linked through the 2A peptide."
        },
        "id": "s1",
        "inputs": [],
        "op": "annotate",
        "outputs": [],
        "params": {}
      }
    ]
  },
  "resources": {
    "containers": [],
    "data": [],
    "equipment": [],
    "materials": [],
    "samples": []
  },
  "schema_version": "0.4"
}
