{
  "schema_version": "0.4",
  "ir_kind": "core",
  "metadata": {
    "title": "Phase I medium addition for iNPC differentiation",
    "source": {
      "type": "paper_pdf",
      "id": "s41596-025-01236-7.pdf"
    }
  },
  "resources": {
    "materials": [
      {
        "id": "culture_medium",
        "name": "culture medium"
      },
      {
        "id": "PBS",
        "name": "PBS"
      },
      {
        "id": "phase_I_medium",
        "name": "phase I medium"
      }
    ],
    "containers": [
      {
        "id": "culture_plate",
        "type": "culture_plate",
        "name": "culture plate"
      }
    ],
    "equipment": [],
    "samples": [],
    "data": []
  },
  "protocol": {
    "steps": [
      {
        "id": "s1",
        "op": "transfer",
        "params": {
          "source": "culture_medium",
          "destination": "waste",
          "action": "aspirate",
          "amount": {
            "value": "unknown",
            "unit": "unknown"
          }
        },
        "inputs": [],
        "outputs": []
      },
      {
        "id": "s2",
        "op": "transfer",
        "params": {
          "source": "PBS",
          "destination": "culture_plate",
          "action": "add",
          "amount": {
            "value": 1.0,
            "unit": "ml"
          }
        },
        "inputs": [],
        "outputs": []
      },
      {
        "id": "s3",
        "op": "transfer",
        "params": {
          "source": "culture_plate",
          "destination": "waste",
          "action": "aspirate",
          "amount": {
            "value": 1.0,
            "unit": "ml"
          }
        },
        "inputs": [],
        "outputs": []
      },
      {
        "id": "s4",
        "op": "transfer",
        "params": {
          "source": "phase_I_medium",
          "destination": "culture_plate",
          "action": "add",
          "amount": {
            "value": 1.0,
            "unit": "ml"
          }
        },
        "inputs": [],
        "outputs": []
      }
    ],
    "start_step_id": "s1",
    "edges": [
      {
        "from": "s1",
        "to": "s2"
      },
      {
        "from": "s2",
        "to": "s3"
      },
      {
        "from": "s3",
        "to": "s4"
      }
    ],
    "detail_level": 0
  }
}