{
  "schema_version": "0.4",
  "ir_kind": "core",
  "metadata": {
    "title": "gDNA extraction, PCR, sequencing and data analysis (Section 4)",
    "source": {
      "type": "paper_pdf",
      "id": "s41596-025-01299-6.pdf"
    }
  },
  "resources": {
    "materials": [],
    "containers": [],
    "equipment": [],
    "samples": [],
    "data": []
  },
  "protocol": {
    "steps": [
      {
        "id": "s1",
        "operation": "annotate",
        "params": {
          "description": "Carry out genomic DNA preparation, PCR and sequencing as for any pooled CRISPR screen."
        },
        "op": "annotate",
        "inputs": [],
        "outputs": []
      },
      {
        "id": "s2",
        "operation": "annotate",
        "params": {
          "description": "Analyze the sequencing data with the CasTLE software, which was previously described30,37. The analysis provides a maximum likelihood estimator that provides for each gene."
        },
        "op": "annotate",
        "inputs": [],
        "outputs": []
      }
    ],
    "start_step_id": "s1",
    "edges": [
      {
        "from": "s1",
        "to": "s2"
      }
    ],
    "detail_level": 0
  }
}