{
  "ir_kind": "core",
  "metadata": {
    "source": {
      "id": "s41592-021-01344-8",
      "type": "paper"
    },
    "title": "Perform permutation enrichment analysis on barcode‑traced organoids"
  },
  "protocol": {
    "detail_level": 0,
    "edges": [
      {
        "from": "s1",
        "to": "s1"
      }
    ],
    "start_step_id": "s1",
    "steps": [
      {
        "annotations": {
          "description": "We performed a permutation enrichment analysis using single cells from all lineage‑traced organoids together to determine the likelihood that barcode families were shared between cell clusters (Fig. 1g and Extended Data Fig. 4a,b)."
        },
        "id": "s1",
        "inputs": [],
        "op": "annotate",
        "outputs": [],
        "params": {}
      }
    ]
  },
  "resources": {
    "containers": [],
    "data": [],
    "equipment": [],
    "materials": [],
    "samples": []
  },
  "schema_version": "0.4"
}
