{
  "ir_kind": "core",
  "metadata": {
    "source": {
      "id": "s41587-023-01718-7",
      "type": "paper"
    },
    "title": "Immunodetect NRP2 blocking antibody"
  },
  "protocol": {
    "detail_level": 0,
    "edges": [
      {
        "from": "s1",
        "to": "s1"
      }
    ],
    "start_step_id": "s1",
    "steps": [
      {
        "annotations": {
          "note": "immunodetection of the NRP2 blocking antibody after treatment indicated its predominant localization in the epicardial layer."
        },
        "id": "s1",
        "inputs": [],
        "op": "annotate",
        "outputs": [],
        "params": {}
      }
    ]
  },
  "resources": {
    "containers": [],
    "data": [],
    "equipment": [],
    "materials": [],
    "samples": []
  },
  "schema_version": "0.4"
}
