{
  "ir_kind": "core",
  "metadata": {
    "source": {
      "id": "s41591-024-02807-z.pdf",
      "type": "paper"
    },
    "title": "Intestinal ring formation assay"
  },
  "protocol": {
    "detail_level": 0,
    "edges": [
      {
        "from": "s1",
        "to": "s1"
      }
    ],
    "start_step_id": "s1",
    "steps": [
      {
        "annotations": {
          "note": "Three hours after seeding, SiAFOs started fusing; by day 2 a more complex tubular budding structure had formed with full ring maturation at day 10."
        },
        "id": "s1",
        "inputs": [],
        "op": "annotate",
        "outputs": [],
        "params": {}
      }
    ]
  },
  "resources": {
    "containers": [],
    "data": [],
    "equipment": [],
    "materials": [],
    "samples": []
  },
  "schema_version": "0.4"
}
